{
  "contractVersion": 1,
  "project": {
    "projectCode": "acmeMobile",
    "customerCode": "acme",
    "displayName": "Acme Mobile"
  },
  "preset": "telco",
  "market": {
    "country": "AE",
    "locale": "en-AE",
    "currency": "AED"
  },
  "frontends": ["AGORA", "AXIS"],
  "sampleData": true,
  "outputRoot": "/workspace/generated/acmeMobile",
  "approvalReference": "CHANGE-1234"
}
